{"ok":true,"runId":"run_fad1e190da1241a2a34be4390050dcd9","status":"running","terminal":false,"message":"Discovery is running.","trigger":"manual","request":{"sheetId":"1mGJ04E3f2Tp0-7ErNlb8veXjnlKz3x5a6gwyzEFvnKQ","variationKey":"default","requestedAt":"2026-04-12T10:00:00Z"},"acceptedAt":"2026-04-12T11:43:54.819Z","updatedAt":"2026-04-12T11:43:54.821Z","warnings":[],"sources":[],"startedAt":"2026-04-12T11:43:54.821Z"}