{"ok":true,"runId":"run_41ad0fd06dd74d8fa81f0f1f14eb85ca","status":"partial","terminal":true,"message":"Discovery completed with warnings — worker processed the run.","trigger":"manual","request":{"sheetId":"1mGJ04E3f2Tp0-7ErNlb8veXjnlKz3x5a6gwyzEFvnKQ","variationKey":"default","requestedAt":"2026-04-12T10:05:00Z"},"acceptedAt":"2026-04-12T11:44:14.707Z","startedAt":"2026-04-12T11:44:14.708Z","completedAt":"2026-04-12T11:45:20.789Z","updatedAt":"2026-04-12T11:45:20.789Z","lifecycle":{"runId":"run_41ad0fd06dd74d8fa81f0f1f14eb85ca","trigger":"manual","startedAt":"2026-04-12T11:44:14.708Z","completedAt":"2026-04-12T11:45:20.789Z","state":"partial","companyCount":3,"detectionCount":0,"listingCount":5,"normalizedLeadCount":3},"writeResult":{"sheetId":"1mGJ04E3f2Tp0-7ErNlb8veXjnlKz3x5a6gwyzEFvnKQ","appended":3,"updated":0,"skippedDuplicates":0,"warnings":[]},"warnings":["Source greenhouse was excluded by preset 'browser_only' and did not execute.","Source ashby was excluded by preset 'browser_only' and did not execute."],"sources":[{"sourceId":"grounded_web","querySummary":"Scale AI Software Engineer JavaScript TypeScript remote jobs | Scale AI Software Engineer JavaScript TypeScript United States jobs | Scale AI Software Engineer JavaScript TypeScript Chicago jobs | Scale AI Software Engineer JavaScript TypeScript Denver jobs | Scale AI Software Engineer JavaScript TypeScript Austin jobs | Scale AI Software Engineer JavaScript TypeScript New York jobs | Scale AI Software Engineer JavaScript TypeScript San Francisco jobs | Scale AI careers | Scale AI jobs | https://vertexaisearch.cloud.google.com/grounding-api-redirect/AUZIYQFyZwJwHlSGnSZgKa59ABkLqsLJJSBLdgjAn5WiCATPf-dQ-5nYaSBJ9BNApJ8yjgE_uWnv08O0eQ0BW4WhwjmuwpLir-hvYs7NuM1d2OePXD3BWbIsEU3vL-bTkX1Brg== | https://vertexaisearch.cloud.google.com/grounding-api-redirect/AUZIYQGK4AHop7wMLZtk8fWIMtw89ohJTnrR-sVY6Cpx36peCY3aUHekIiQcCvAhi4H9aTtBg7pX68GPTJDdFSm5_KN4fl5l-T9yep9ODGrtcnZHw6x0vv5gWRmTmpLA0J3bofg4CCpF1IL4ARDvx3TL1nAkGauK | Figma careers Software Engineer JavaScript TypeScript remote | Figma jobs Software Engineer JavaScript TypeScript United States remote | Figma careers Software Engineer JavaScript TypeScript Chicago remote | Figma careers Software Engineer JavaScript TypeScript Denver remote | Figma careers Software Engineer JavaScript TypeScript Austin remote | Figma careers Software Engineer JavaScript TypeScript New York remote | Figma careers Software Engineer JavaScript TypeScript San Francisco remote | Figma Software Engineer JavaScript TypeScript jobs -\"account executive\" -recruiter -finance -legal | https://vertexaisearch.cloud.google.com/grounding-api-redirect/AUZIYQGDizKD9er6VG4WQOgTXcb_sjf30twPfry6pureBcmqvP3tiYCV0kNFFLd9XJ8Hg_7Z4eaTc0PMf62PLs_7UJqKXe0luBVUHsQiCwE6_w9jrl8WWasjfIFS8SECKaCwdvz6j_aAmK4nxm2HXk_TMicQDiL4RIgpROuV1MsIWFfArCg= | https://vertexaisearch.cloud.google.com/grounding-api-redirect/AUZIYQGeCwCZ1jZv-sgtegkbbHtB0ClF-IjRPdHQBy_9cvdEYYyb41gaysFoKQH8Mt922DwdnSIBtDWUTCen9i9l4zJ2mdBSa-fYhadfPL1V37eHmxd60kLsPQM0nbAmJrv2u2PkfGhIBQhYbi37mVBQQL6B | https://vertexaisearch.cloud.google.com/grounding-api-redirect/AUZIYQHUTuVeAjYW3OsM-83jlI-24hS37hz8lwYzb3GvkP09TA7SwSyKcJ3nxbLDCY8sKJK7t4hMBjk-6dOX56KgKHaijYDGBNXrGMYoWkAuZJ6foxcz74DhgoPEp6LDJt0SOv34gkPgJtrxn5W_nAEN9J-ofSEgY5GCgwcEi-kusjhkhoKtM455 | https://vertexaisearch.cloud.google.com/grounding-api-redirect/AUZIYQFF-fBU9VUSnWbgAe3f77CwmPN92vLVAEktuSI3WdUvFKHLXeSS6ttM1AcNO-9TMH9oWJRoictN9A0g6Pf3uOlBhREvzhDbvH-l03fZRdr5yE0eyh9kEeFJxhUYcKQEiL_LExlGDlT1U021rVsfZysdZ7ZthgVwXTrNPurDf3fQRPw= | Notion careers | Notion jobs | Notion Software Engineer jobs remote JavaScript TypeScript | Notion Software Engineer jobs United States JavaScript TypeScript remote | Notion Software Engineer jobs Chicago JavaScript TypeScript remote | Notion Software Engineer jobs Denver JavaScript TypeScript remote | Notion Software Engineer jobs Austin JavaScript TypeScript remote | Notion Software Engineer jobs New York JavaScript TypeScript remote | Notion Software Engineer jobs San Francisco JavaScript TypeScript remote | Notion Software Engineer JavaScript TypeScript | https://www.notion.so/jobs/software-engineer-fullstack-early-career | https://www.notion.so/jobs/software-engineer-developer-experience | https://www.notion.so/jobs/forward-deployed-software-engineer-developer-platform | https://www.notion.so/jobs/software-engineer-ai-workflows","pagesVisited":10,"leadsSeen":5,"leadsAccepted":3,"leadsRejected":2,"warnings":[],"rejectionSummary":{"totalRejected":2,"rejectionReasons":{"headline_mismatch":2},"rejectionSamples":[{"reason":"headline_mismatch","title":"Remote","company":"Figma","url":"https://vertexaisearch.cloud.google.com/jobs/remote","detail":"Structured match rejected the role title \"Remote\". Remote policy aligned | AI matcher returned invalid JSON. score=0.51 confidence=0.67 matcher=deterministic-structured-v1"},{"reason":"headline_mismatch","title":"Save","company":"Figma","url":"https://vertexaisearch.cloud.google.com/auth/login?destination=/job/software-engineer-product-foundations/3544632","detail":"Structured match rejected the role title \"Save\". Remote policy unknown from structured fields | AI matcher returned invalid JSON. score=0.45 confidence=0.62 matcher=deterministic-structured-v1"}]}},{"sourceId":"greenhouse","querySummary":"","pagesVisited":0,"leadsSeen":0,"leadsAccepted":0,"leadsRejected":0,"warnings":["Source greenhouse was excluded by preset 'browser_only' and did not execute."]},{"sourceId":"ashby","querySummary":"","pagesVisited":0,"leadsSeen":0,"leadsAccepted":0,"leadsRejected":0,"warnings":["Source ashby was excluded by preset 'browser_only' and did not execute."]}]}