{"ok":true,"runId":"run_2dc0824c1ea34e1ba65290c8fadf1b63","status":"partial","terminal":true,"message":"Discovery completed with warnings — worker processed the run.","trigger":"manual","request":{"sheetId":"1mGJ04E3f2Tp0-7ErNlb8veXjnlKz3x5a6gwyzEFvnKQ","variationKey":"test_cross_001","requestedAt":"2026-04-12T10:00:00.000Z"},"acceptedAt":"2026-04-12T07:41:07.270Z","startedAt":"2026-04-12T07:41:07.271Z","completedAt":"2026-04-12T07:41:48.992Z","updatedAt":"2026-04-12T07:41:48.992Z","lifecycle":{"runId":"run_2dc0824c1ea34e1ba65290c8fadf1b63","trigger":"manual","startedAt":"2026-04-12T07:41:07.271Z","completedAt":"2026-04-12T07:41:48.992Z","state":"partial","companyCount":3,"detectionCount":0,"listingCount":0,"normalizedLeadCount":0},"writeResult":{"sheetId":"1mGJ04E3f2Tp0-7ErNlb8veXjnlKz3x5a6gwyzEFvnKQ","appended":0,"updated":0,"skippedDuplicates":0,"warnings":[]},"warnings":["Grounded search returned no usable candidate links.","Grounded search returned no usable candidate links.","Grounded search returned no usable candidate links.","Source greenhouse was excluded by preset 'browser_only' and did not execute.","Source ashby was excluded by preset 'browser_only' and did not execute."],"sources":[{"sourceId":"grounded_web","querySummary":"Scale AI careers | Scale AI jobs remote | Scale AI Performance Marketing jobs | Scale AI Growth Marketing jobs | Scale AI Marketing Operations jobs | Scale AI AI Strategy jobs | Scale AI AI Automation jobs | Scale AI Product Manager jobs | Scale AI Community jobs | \"Performance Marketing\" OR \"Growth Marketing\" OR \"Marketing Operations\" OR \"AI Strategy\" OR \"AI Automation\" OR \"Product Manager\" OR \"Community\" \"AI\" OR \"agent\" OR \"automation\" OR \"prompt\" OR \"growth\" OR \"marketing\" OR \"product\" OR \"community\" OR \"operations\" -(\"account executive\" OR \"recruiter\" OR \"finance\" OR \"legal\") (remote OR \"United States\" OR Chicago OR Denver OR Austin OR \"New York\" OR \"San Francisco\") | jobs \"Product Manager\" \"AI\" OR \"automation\" -(\"account executive\" OR \"recruiter\" OR \"finance\" OR \"legal\") (remote OR \"United States\") | jobs \"Growth Marketing\" \"AI\" OR \"automation\" OR \"prompt\" -(\"account executive\" OR \"recruiter\" OR \"finance\" OR \"legal\") (remote OR \"United States\") | jobs \"Marketing Operations\" -(\"account executive\" OR \"recruiter\" OR \"finance\" OR \"legal\") (remote OR \"United States\") | jobs \"Community\" -(\"account executive\" OR \"recruiter\" OR \"finance\" OR \"legal\") (remote OR \"United States\") | \"Performance Marketing\" OR \"Growth Marketing\" OR \"Marketing Operations\" OR \"AI Strategy\" OR \"AI Automation\" OR \"Product Manager\" OR \"Community\" AI OR agent OR automation OR prompt OR growth OR marketing OR product OR community OR operations -account -recruiter -finance -legal remote OR \"United States\" OR Chicago OR Denver OR Austin OR \"New York\" OR \"San Francisco\" | jobs | Notion careers | Notion jobs remote | Notion Performance Marketing jobs remote AI growth | Notion Growth Marketing jobs remote AI automation | Notion Marketing Operations jobs remote | Notion AI Strategy jobs remote | Notion AI Automation jobs remote | Notion Product Manager jobs remote AI | Notion Community jobs remote growth","pagesVisited":0,"leadsSeen":0,"leadsAccepted":0,"leadsRejected":0,"warnings":["Grounded search returned no usable candidate links.","Grounded search returned no usable candidate links.","Grounded search returned no usable candidate links."]},{"sourceId":"greenhouse","querySummary":"","pagesVisited":0,"leadsSeen":0,"leadsAccepted":0,"leadsRejected":0,"warnings":["Source greenhouse was excluded by preset 'browser_only' and did not execute."]},{"sourceId":"ashby","querySummary":"","pagesVisited":0,"leadsSeen":0,"leadsAccepted":0,"leadsRejected":0,"warnings":["Source ashby was excluded by preset 'browser_only' and did not execute."]}]}