{"ok":true,"runId":"run_909343a57c7f4a93b9468f8d9df94313","status":"partial","terminal":true,"message":"Discovery completed with warnings — worker processed the run.","trigger":"manual","request":{"sheetId":"1mGJ04E3f2Tp0-7ErNlb8veXjnlKz3x5a6gwyzEFvnKQ","variationKey":"default","requestedAt":"2026-04-12T10:06:00Z"},"acceptedAt":"2026-04-12T11:44:21.241Z","startedAt":"2026-04-12T11:44:21.242Z","completedAt":"2026-04-12T11:48:05.086Z","updatedAt":"2026-04-12T11:48:05.086Z","lifecycle":{"runId":"run_909343a57c7f4a93b9468f8d9df94313","trigger":"manual","startedAt":"2026-04-12T11:44:21.242Z","completedAt":"2026-04-12T11:48:05.086Z","state":"partial","companyCount":3,"detectionCount":6,"listingCount":487,"normalizedLeadCount":13},"writeResult":{"sheetId":"1mGJ04E3f2Tp0-7ErNlb8veXjnlKz3x5a6gwyzEFvnKQ","appended":9,"updated":4,"skippedDuplicates":0,"warnings":[]},"warnings":["Truncated leads to maxLeadsPerRun=20.","Source grounded_web was excluded by preset 'ats_only' and did not execute."],"sources":[{"sourceId":"greenhouse","querySummary":"https://boards.greenhouse.io/scaleai | https://boards.greenhouse.io/figma | https://boards.greenhouse.io/notion","pagesVisited":3,"leadsSeen":330,"leadsAccepted":44,"leadsRejected":286,"warnings":[],"rejectionSummary":{"totalRejected":286,"rejectionReasons":{"headline_mismatch":198,"excluded_keyword":56,"remote_policy_mismatch":13,"location_mismatch":19},"rejectionSamples":[{"reason":"headline_mismatch","title":"Account Based Marketing Manager","company":"Scale AI","url":"https://job-boards.greenhouse.io/scaleai/jobs/4675749005","detail":"Structured match rejected the role title \"Account Based Marketing Manager\". Matched locations: United States, New York, San Francisco | Remote policy unknown from structured fields | Soft exclude keywords only in description: recruiter | AI matcher returned invalid JSON. score=0.45 confidence=0.82 matcher=deterministic-structured-v1"},{"reason":"headline_mismatch","title":"AI Applications Ops Lead, GPS","company":"Scale AI","url":"https://job-boards.greenhouse.io/scaleai/jobs/4654510005","detail":"Structured match rejected the role title \"AI Applications Ops Lead, GPS\". Remote policy unknown from structured fields | AI matcher returned invalid JSON. score=0.35 confidence=0.62 matcher=deterministic-structured-v1"},{"reason":"headline_mismatch","title":"AI Deployment Strategist Intern","company":"Scale AI","url":"https://job-boards.greenhouse.io/scaleai/jobs/4677519005","detail":"Structured match rejected the role title \"AI Deployment Strategist Intern\". Matched locations: United States, New York | Remote policy unknown from structured fields | Soft exclude keywords only in description: finance | AI matcher returned invalid JSON. score=0.45 confidence=0.77 matcher=deterministic-structured-v1"},{"reason":"headline_mismatch","title":"AI Product Manager","company":"Scale AI","url":"https://job-boards.greenhouse.io/scaleai/jobs/4609736005","detail":"Structured match rejected the role title \"AI Product Manager\". Matched locations: United States, San Francisco | Remote policy unknown from structured fields | Soft exclude keywords only in description: recruiter | AI matcher returned invalid JSON. score=0.45 confidence=0.77 matcher=deterministic-structured-v1"},{"reason":"headline_mismatch","title":"AI Product Manager, Insights","company":"Scale AI","url":"https://job-boards.greenhouse.io/scaleai/jobs/4651491005","detail":"Structured match rejected the role title \"AI Product Manager, Insights\". Matched locations: United States, San Francisco | Remote policy unknown from structured fields | Soft exclude keywords only in description: recruiter | AI matcher returned invalid JSON. score=0.45 confidence=0.77 matcher=deterministic-structured-v1"}]}},{"sourceId":"ashby","querySummary":"https://jobs.ashbyhq.com/scale-ai | https://jobs.ashbyhq.com/figma | https://jobs.ashbyhq.com/notion","pagesVisited":3,"leadsSeen":157,"leadsAccepted":3,"leadsRejected":154,"warnings":[],"rejectionSummary":{"totalRejected":154,"rejectionReasons":{"excluded_keyword":38,"remote_policy_mismatch":109,"headline_mismatch":6,"location_mismatch":1},"rejectionSamples":[{"reason":"excluded_keyword","title":"Account Executive, Mid-Market","company":"Notion","url":"https://jobs.ashbyhq.com/notion/0fe96f47-a9ea-4623-ac73-9053c3541297","detail":"Headline matched exclude keywords: account executive. [matcher=deterministic-structured-v1]"},{"reason":"excluded_keyword","title":"Enterprise Account Executive, San Francisco","company":"Notion","url":"https://jobs.ashbyhq.com/notion/479b8826-d166-433b-8d7e-373cda9c533e","detail":"Headline matched exclude keywords: account executive. [matcher=deterministic-structured-v1]"},{"reason":"remote_policy_mismatch","title":"Outbound Business Development Representative","company":"Notion","url":"https://jobs.ashbyhq.com/notion/05e14247-17c4-4e98-9a13-53828a4e2f13","detail":"Remote policy \"remote\" did not align with location \"New York, New York\". Matched locations: New York | Job appears onsite while target policy is remote | Soft exclude keywords only in description: recruiter, legal score=0.36 confidence=0.72 matcher=deterministic-structured-v1"},{"reason":"excluded_keyword","title":"Account Executive, Commercial","company":"Notion","url":"https://jobs.ashbyhq.com/notion/0810dcca-ac29-4f72-b44f-a777d0108550","detail":"Headline matched exclude keywords: account executive. [matcher=deterministic-structured-v1]"},{"reason":"remote_policy_mismatch","title":"Solutions Engineer, EMEA","company":"Notion","url":"https://jobs.ashbyhq.com/notion/6ad34426-b980-436b-80c4-3634c00094ad","detail":"Remote policy \"remote\" did not align with location \"Dublin, Ireland\". Job appears onsite while target policy is remote | Soft exclude keywords only in description: recruiter, legal score=0.18 confidence=0.67 matcher=deterministic-structured-v1"}]}},{"sourceId":"grounded_web","querySummary":"","pagesVisited":0,"leadsSeen":0,"leadsAccepted":0,"leadsRejected":0,"warnings":["Source grounded_web was excluded by preset 'ats_only' and did not execute."]}]}