{"ok":true,"runId":"run_7b68346276004c89a4bbb6d9a626a050","status":"partial","terminal":true,"message":"Discovery completed with warnings — worker processed the run.","trigger":"manual","request":{"sheetId":"1mGJ04E3f2Tp0-7ErNlb8veXjnlKz3x5a6gwyzEFvnKQ","variationKey":"test-val-api-005-browser-plus-ats","requestedAt":"2026-04-12T10:26:00.000Z"},"acceptedAt":"2026-04-12T19:04:54.884Z","startedAt":"2026-04-12T19:04:54.885Z","completedAt":"2026-04-12T19:05:15.436Z","updatedAt":"2026-04-12T19:05:15.436Z","lifecycle":{"runId":"run_7b68346276004c89a4bbb6d9a626a050","trigger":"manual","startedAt":"2026-04-12T19:04:54.885Z","completedAt":"2026-04-12T19:05:15.436Z","state":"partial","companyCount":0,"detectionCount":0,"listingCount":0,"normalizedLeadCount":0},"writeResult":{"sheetId":"1mGJ04E3f2Tp0-7ErNlb8veXjnlKz3x5a6gwyzEFvnKQ","appended":0,"updated":0,"skippedDuplicates":0,"warnings":[]},"warnings":["No boards detected for greenhouse in unrestricted scope (empty company target).","No boards detected for ashby in unrestricted scope (empty company target).","Grounded search returned no usable candidate links."],"sources":[{"sourceId":"greenhouse","querySummary":"","pagesVisited":0,"leadsSeen":0,"leadsAccepted":0,"leadsRejected":0,"warnings":["No boards detected for greenhouse in unrestricted scope (empty company target)."]},{"sourceId":"ashby","querySummary":"","pagesVisited":0,"leadsSeen":0,"leadsAccepted":0,"leadsRejected":0,"warnings":["No boards detected for ashby in unrestricted scope (empty company target)."]},{"sourceId":"grounded_web","querySummary":"\"Software Engineer\" AI Python remote jobs careers - \"account executive\" -recruiter -finance -legal | \"Software Engineer\" AI Python \"United States\" remote jobs careers - \"account executive\" -recruiter -finance -legal | \"Software Engineer\" AI Python \"Chicago\" \"remote\" jobs careers - \"account executive\" -recruiter -finance -legal | \"Software Engineer\" AI Python \"Denver\" \"remote\" jobs careers - \"account executive\" -recruiter -finance -legal","pagesVisited":0,"leadsSeen":0,"leadsAccepted":0,"leadsRejected":0,"warnings":["Grounded search returned no usable candidate links."]}]}