{"ok":true,"runId":"run_9754144f162c4592aeeee8bfa0766865","status":"partial","terminal":true,"message":"Discovery completed with warnings — worker processed the run.","trigger":"manual","request":{"sheetId":"1mGJ04E3f2Tp0-7ErNlb8veXjnlKz3x5a6gwyzEFvnKQ","variationKey":"test-route-val","requestedAt":"2026-04-11T12:00:00.000Z"},"acceptedAt":"2026-04-12T03:02:53.436Z","startedAt":"2026-04-12T03:02:53.438Z","completedAt":"2026-04-12T03:02:53.440Z","updatedAt":"2026-04-12T03:02:53.440Z","lifecycle":{"runId":"run_9754144f162c4592aeeee8bfa0766865","trigger":"manual","startedAt":"2026-04-12T03:02:53.438Z","completedAt":"2026-04-12T03:02:53.440Z","state":"partial","companyCount":3,"detectionCount":0,"listingCount":0,"normalizedLeadCount":0},"writeResult":{"sheetId":"1mGJ04E3f2Tp0-7ErNlb8veXjnlKz3x5a6gwyzEFvnKQ","appended":0,"updated":0,"skippedDuplicates":0,"warnings":[]},"warnings":["Grounded web source is enabled but BROWSER_USE_DISCOVERY_GEMINI_API_KEY is not configured.","Source greenhouse was excluded by preset 'browser_only' and did not execute.","Source ashby was excluded by preset 'browser_only' and did not execute."],"sources":[{"sourceId":"grounded_web","querySummary":"","pagesVisited":0,"leadsSeen":0,"leadsAccepted":0,"leadsRejected":0,"warnings":["Grounded web source is enabled but BROWSER_USE_DISCOVERY_GEMINI_API_KEY is not configured."]},{"sourceId":"greenhouse","querySummary":"","pagesVisited":0,"leadsSeen":0,"leadsAccepted":0,"leadsRejected":0,"warnings":["Source greenhouse was excluded by preset 'browser_only' and did not execute."]},{"sourceId":"ashby","querySummary":"","pagesVisited":0,"leadsSeen":0,"leadsAccepted":0,"leadsRejected":0,"warnings":["Source ashby was excluded by preset 'browser_only' and did not execute."]}]}