{"ok":true,"runId":"run_7b68346276004c89a4bbb6d9a626a050","status":"running","terminal":false,"message":"Discovery is running.","trigger":"manual","request":{"sheetId":"1mGJ04E3f2Tp0-7ErNlb8veXjnlKz3x5a6gwyzEFvnKQ","variationKey":"test-val-api-005-browser-plus-ats","requestedAt":"2026-04-12T10:26:00.000Z"},"acceptedAt":"2026-04-12T19:04:54.884Z","updatedAt":"2026-04-12T19:04:54.885Z","warnings":[],"sources":[],"startedAt":"2026-04-12T19:04:54.885Z"}