{"ok":true,"runId":"run_24254adbd9e64e25add918bf6b8244bf","status":"running","terminal":false,"message":"Discovery is running.","trigger":"manual","request":{"sheetId":"1mGJ04E3f2Tp0-7ErNlb8veXjnlKz3x5a6gwyzEFvnKQ","variationKey":"test-val-api-001","requestedAt":"2026-04-12T10:00:00.000Z"},"acceptedAt":"2026-04-12T19:03:00.538Z","updatedAt":"2026-04-12T19:03:00.539Z","warnings":[],"sources":[],"startedAt":"2026-04-12T19:03:00.539Z"}